{
  "$schema": "https://json-schema.org/draft/2020-12/schema",
  "title": "DecisionPointOverriddenPayload",
  "description": "Unchanged 3.x override payload. In 4.0.0 it optionally carries origin_surface for replay context.",
  "type": "object",
  "additionalProperties": false,
  "required": [
    "decision_point_id", "mission_id", "run_id", "mission_slug", "mission_type", "phase",
    "actor_id", "actor_type", "authority_role",
    "mission_owner_authority_flag", "mission_owner_authority_path",
    "rationale", "alternatives_considered", "evidence_refs",
    "state_entered_at", "recorded_at"
  ],
  "properties": {
    "origin_surface": { "enum": ["adr", "planning_interview"] },
    "decision_point_id": { "type": "string", "minLength": 1 },
    "mission_id": { "type": "string", "minLength": 1 },
    "run_id": { "type": "string", "minLength": 1 },
    "mission_slug": { "type": "string", "minLength": 1 },
    "mission_type": { "type": "string", "minLength": 1 },
    "phase": { "type": "string", "minLength": 1 },
    "actor_id": { "type": "string", "minLength": 1 },
    "actor_type": { "enum": ["human", "llm", "service"] },
    "authority_role": { "enum": ["mission_owner", "advisory", "informed"] },
    "mission_owner_authority_flag": { "type": "boolean" },
    "mission_owner_authority_path": { "type": "string" },
    "rationale": { "type": "string", "minLength": 1 },
    "alternatives_considered": { "type": "array", "items": { "type": "string" }, "minItems": 1 },
    "evidence_refs": { "type": "array", "items": { "type": "string" }, "minItems": 1 },
    "state_entered_at": { "type": "string", "format": "date-time" },
    "recorded_at": { "type": "string", "format": "date-time" }
  }
}
