{
  "origin_surface": "adr",
  "decision_point_id": "dp-005",
  "mission_id": "m-004",
  "run_id": "run-004",
  "phase": "P0",
  "actor_id": "llm-agent-1",
  "actor_type": "llm",
  "authority_role": "advisory",
  "mission_owner_authority_flag": false,
  "mission_owner_authority_path": "/missions/m-004/advisory",
  "rationale": "LLM opened decision point in P0 phase",
  "alternatives_considered": [
    "Auto-detect",
    "Manual"
  ],
  "evidence_refs": [
    "ref-llm-001"
  ],
  "state_entered_at": "2026-02-27T16:00:00+00:00",
  "recorded_at": "2026-02-27T16:00:01+00:00",
  "mission_slug": "mission-x",
  "mission_type": "software-dev"
}
