{
  "origin_surface": "adr",
  "decision_point_id": "dp-006",
  "mission_id": "m-005",
  "run_id": "run-005",
  "phase": "P1",
  "actor_id": "ci-service-1",
  "actor_type": "service",
  "authority_role": "informed",
  "mission_owner_authority_flag": false,
  "mission_owner_authority_path": "/missions/m-005/service",
  "rationale": "Automated service detected configuration conflict",
  "alternatives_considered": [
    "Merge",
    "Override"
  ],
  "evidence_refs": [
    "ref-svc-001",
    "ref-svc-002"
  ],
  "state_entered_at": "2026-02-27T17:00:00+00:00",
  "recorded_at": "2026-02-27T17:00:01+00:00",
  "mission_slug": "mission-x",
  "mission_type": "software-dev"
}
